
Date,Name,Tags,URL,Description
2019-10-27,Black Mirror Ranked,,https://boxd.it/47xso,"Every episode of Black Mirror that I've seen, ranked.

Show Average: 3.2 Stars"

Position,Name,Year,URL,Description
1,Black Mirror: Shut Up and Dance,2016,https://boxd.it/hRRq,
2,Black Mirror: White Christmas,2014,https://boxd.it/udfW,
3,Black Mirror: Smithereens,2019,https://boxd.it/mltc,
4,Black Mirror: Metalhead,2017,https://boxd.it/hRqk,
5,Black Mirror: Hang the DJ,2017,https://boxd.it/hQYA,
6,Black Mirror: White Bear,2013,https://boxd.it/hRpG,
7,Black Mirror: The National Anthem,2011,https://boxd.it/hQYK,
8,Black Mirror: Striking Vipers,2019,https://boxd.it/mlse,
9,Black Mirror: Nosedive,2016,https://boxd.it/hK9G,
10,Black Mirror: Fifteen Million Merits,2011,https://boxd.it/hQYU,
11,Black Mirror: Men Against Fire,2016,https://boxd.it/hSBS,
12,Black Mirror: San Junipero,2016,https://boxd.it/h634,
13,Black Mirror: Black Museum,2017,https://boxd.it/hRqu,
14,"Black Mirror: Rachel, Jack and Ashley Too",2019,https://boxd.it/mltQ,
